{
  "schemaVersion": "1.0.0",
  "protocolVersion": "1.0.0",
  "id": "adapter:research:last30days",
  "name": "last30days-skill",
  "version": "0.0.0-plan",
  "category": "research",
  "status": "planned",
  "enabledByDefault": false,
  "upstream": {
    "repository": "https://github.com/mvanhorn/last30days-skill",
    "commit": "UNPINNED",
    "checksum": "UNVERIFIED"
  },
  "licenseReview": {
    "status": "required",
    "spdx": "UNVERIFIED",
    "reviewedAt": null,
    "notes": "Re-verify license and notices at the exact pinned commit."
  },
  "trustBoundary": {
    "summary": "Networked read, platform terms, optional keys/cookies, untrusted content",
    "network": "deny until reviewed",
    "filesystem": "deny until reviewed",
    "secrets": "none until reviewed",
    "sideEffectClass": "read-only or local-derived"
  },
  "contract": "ResearchSourcePort",
  "capabilities": [
    "research.recent-signals",
    "research.source-citations"
  ],
  "installation": {
    "mode": "cli",
    "command": "last30days",
    "requiresNetwork": true
  },
  "conformance": {
    "fixture": "fixtures/conformance.json",
    "status": "not-run",
    "lastRunAt": null
  },
  "maintainer": null
}
