{
  "schemaVersion": "1.0.0",
  "protocolVersion": "1.0.0",
  "id": "adapter:tool:graphify",
  "name": "Graphify",
  "version": "0.0.0-plan",
  "category": "tool",
  "status": "planned",
  "enabledByDefault": false,
  "upstream": {
    "repository": "https://github.com/safishamsi/graphify",
    "commit": "UNPINNED",
    "checksum": "UNVERIFIED"
  },
  "licenseReview": {
    "status": "required",
    "spdx": "UNVERIFIED",
    "reviewedAt": null,
    "notes": "Re-verify license and notices at the exact pinned commit."
  },
  "trustBoundary": {
    "summary": "CLI subprocess, repository read, generated graph artifacts",
    "network": "deny until reviewed",
    "filesystem": "deny until reviewed",
    "secrets": "none until reviewed",
    "sideEffectClass": "read-only or local-derived"
  },
  "contract": "RepositoryGraphPort",
  "capabilities": [
    "knowledge.graph.build",
    "knowledge.graph.export"
  ],
  "installation": {
    "mode": "cli",
    "command": "graphify",
    "requiresNetwork": false
  },
  "conformance": {
    "fixture": "fixtures/conformance.json",
    "status": "not-run",
    "lastRunAt": null
  },
  "maintainer": null
}
