{
  "schemaVersion": "1.0.0",
  "protocolVersion": "1.0.0",
  "id": "adapter:memory:claude-mem",
  "name": "claude-mem",
  "version": "0.0.0-plan",
  "category": "memory",
  "status": "planned",
  "enabledByDefault": false,
  "upstream": {
    "repository": "https://github.com/thedotmack/claude-mem",
    "commit": "UNPINNED",
    "checksum": "UNVERIFIED"
  },
  "licenseReview": {
    "status": "required",
    "spdx": "UNVERIFIED",
    "reviewedAt": null,
    "notes": "Re-verify license and notices at the exact pinned commit."
  },
  "trustBoundary": {
    "summary": "Local worker, SQLite/vector state, lifecycle hooks, model summarization",
    "network": "deny until reviewed",
    "filesystem": "deny until reviewed",
    "secrets": "none until reviewed",
    "sideEffectClass": "read-only or local-derived"
  },
  "contract": "MemoryBackendPort",
  "capabilities": [
    "memory.search",
    "memory.timeline",
    "memory.read"
  ],
  "installation": {
    "mode": "http",
    "command": null,
    "requiresNetwork": false
  },
  "conformance": {
    "fixture": "fixtures/conformance.json",
    "status": "not-run",
    "lastRunAt": null
  },
  "maintainer": null
}
